{
  "tool": "BareFlux",
  "version": "0.2.0",
  "run_id": "20260707T181730Z_e9fc81",
  "created_at_utc": "2026-07-07T18:17:30.194251+00:00",
  "command": "bareflux run",
  "inputs": [
    {
      "path": "inputs/minimal_timeseries.csv",
      "kind": "csv"
    }
  ],
  "config": {
    "path": "config_used.json"
  },
  "series": [
    {
      "name": "minimal",
      "path": "series/minimal",
      "artifacts": [
        "report.json",
        "features.csv",
        "rupture_marks.csv",
        "errors.json"
      ]
    }
  ]
}
